Titulo,Creador,Fecha de publicacion,Categoria
El gasto militar mundial creció en 2020 a pesar de la pandemia,Sin Categoria,La Opinión de Murcia,26/04/0021,10:32:37
India recibe apoyo internacional en medio de la grave crisis por la covid-19,Sin Categoria,La Opinión de Murcia,26/04/0021,10:27:51
Los peores looks de la alfombra roja de los Premios Oscars 2021,Sin Categoria,La Opinión de Murcia,26/04/0021,10:25:49
Suspendidos los Sanfermines por segundo año consecutivo debido a la covid-19,Sin Categoria,La Opinión de Murcia,26/04/0021,10:22:46
La Región registra un crecimiento del 161% en ampliaciones de capital,Sin Categoria,La Opinión de Murcia,26/04/0021,10:22:02
Recomiendan este entrenamiento para recuperar el olfato después del coronavirus,Sin Categoria,La Opinión de Murcia,26/04/0021,10:19:33
"España perderá entre el 2,5% y el 9,7% de su PIB en 2050 por el cambio climático",Sin Categoria,La Opinión de Murcia,26/04/0021,10:19:13
Silvia Márquez se une a la OSRM para presentar en directo su nuevo disco,Sin Categoria,La Opinión de Murcia,26/04/0021,10:18:27
Los mayores vacunados en las residencias ya pueden realizar salidas con sus familiares,Sin Categoria,La Opinión de Murcia,26/04/0021,10:15:44
Europa abre la puerta a la llegada de turistas estadounidenses vacunados,Sin Categoria,La Opinión de Murcia,26/04/0021,10:13:24
"Mónica García: ""Lo que nos ofrece Ayuso es volver a ser rehén, ahora de Vox""",Sin Categoria,La Opinión de Murcia,26/04/0021,10:04:20
"Marisa Paredes pone en su sitio a Miguel Bose y opina de Ayuso: ""Es impresentable""",Sin Categoria,La Opinión de Murcia,26/04/0021,09:54:18
Liberan en Toledo a una mujer retenida y agredida sexualmente,Sin Categoria,La Opinión de Murcia,26/04/0021,09:51:51
"Monasterio propone realizar un debate sin la izquierda ""que no quiere ir""",Sin Categoria,La Opinión de Murcia,26/04/0021,09:48:50
Funcionarios de prisiones se concentran en apoyo al compañero agredido por un preso,Sin Categoria,La Opinión de Murcia,26/04/0021,09:46:24
Nadal recupera el número 2 del ranking mundial,Sin Categoria,La Opinión de Murcia,26/04/0021,09:43:37
Love of Lesbian: ?En este país te ponen en la lista de extremistas muy rápidamente?,Sin Categoria,La Opinión de Murcia,26/04/0021,09:39:01
Aquí se 'fabrica' el tren del futuro,Sin Categoria,La Opinión de Murcia,26/04/0021,09:19:32
"¿Cómo funciona el C-40, el club de ciudades que luchan para salvar el clima?",Sin Categoria,La Opinión de Murcia,26/04/0021,09:16:34
Denuncian la desaparición de un niño en Cieza,Sin Categoria,La Opinión de Murcia,26/04/0021,09:13:15
